
T:  Bus=01 Lev=00 Prnt=00 Port=00 Cnt=00 Dev#=  1 Spd=480 MxCh= 3
D:  Ver= 2.00 Cls=09(hub  ) Sub=00 Prot=00 MxPS=64 #Cfgs=  1
P:  Vendor=1d6b ProdID=0002 Rev=03.13
S:  Manufacturer=Linux 3.13.0-34-generic ehci_hcd
S:  Product=EHCI Host Controller
S:  SerialNumber=0000:00:1a.0
C:  #Ifs= 1 Cfg#= 1 Atr=e0 MxPwr=0mA
I:  If#= 0 Alt= 0 #EPs= 1 Cls=09(hub  ) Sub=00 Prot=00 Driver=hub

T:  Bus=01 Lev=01 Prnt=01 Port=00 Cnt=01 Dev#=  2 Spd=480 MxCh= 6
D:  Ver= 2.00 Cls=09(hub  ) Sub=00 Prot=01 MxPS=64 #Cfgs=  1
P:  Vendor=8087 ProdID=8008 Rev=00.04
C:  #Ifs= 1 Cfg#= 1 Atr=e0 MxPwr=0mA
I:  If#= 0 Alt= 0 #EPs= 1 Cls=09(hub  ) Sub=00 Prot=00 Driver=hub

T:  Bus=02 Lev=00 Prnt=00 Port=00 Cnt=00 Dev#=  1 Spd=480 MxCh= 3
D:  Ver= 2.00 Cls=09(hub  ) Sub=00 Prot=00 MxPS=64 #Cfgs=  1
P:  Vendor=1d6b ProdID=0002 Rev=03.13
S:  Manufacturer=Linux 3.13.0-34-generic ehci_hcd
S:  Product=EHCI Host Controller
S:  SerialNumber=0000:00:1d.0
C:  #Ifs= 1 Cfg#= 1 Atr=e0 MxPwr=0mA
I:  If#= 0 Alt= 0 #EPs= 1 Cls=09(hub  ) Sub=00 Prot=00 Driver=hub

T:  Bus=02 Lev=01 Prnt=01 Port=00 Cnt=01 Dev#=  2 Spd=480 MxCh= 8
D:  Ver= 2.00 Cls=09(hub  ) Sub=00 Prot=01 MxPS=64 #Cfgs=  1
P:  Vendor=8087 ProdID=8000 Rev=00.04
C:  #Ifs= 1 Cfg#= 1 Atr=e0 MxPwr=0mA
I:  If#= 0 Alt= 0 #EPs= 1 Cls=09(hub  ) Sub=00 Prot=00 Driver=hub

T:  Bus=03 Lev=00 Prnt=00 Port=00 Cnt=00 Dev#=  1 Spd=480 MxCh=14
D:  Ver= 2.00 Cls=09(hub  ) Sub=00 Prot=01 MxPS=64 #Cfgs=  1
P:  Vendor=1d6b ProdID=0002 Rev=03.13
S:  Manufacturer=Linux 3.13.0-34-generic xhci_hcd
S:  Product=xHCI Host Controller
S:  SerialNumber=0000:00:14.0
C:  #Ifs= 1 Cfg#= 1 Atr=e0 MxPwr=0mA
I:  If#= 0 Alt= 0 #EPs= 1 Cls=09(hub  ) Sub=00 Prot=00 Driver=hub

T:  Bus=03 Lev=01 Prnt=01 Port=01 Cnt=01 Dev#=  6 Spd=480 MxCh= 0
D:  Ver= 2.01 Cls=00(>ifc ) Sub=00 Prot=00 MxPS=64 #Cfgs=  1
P:  Vendor=1bbb ProdID=f000 Rev=02.28
S:  Manufacturer=AT&T
S:  Product=Modio
S:  SerialNumber=0123456789ABCDEF
C:  #Ifs= 1 Cfg#= 1 Atr=80 MxPwr=500mA
I:  If#= 0 Alt= 0 #EPs= 2 Cls=08(stor.) Sub=06 Prot=50 Driver=(none)

T:  Bus=03 Lev=01 Prnt=01 Port=02 Cnt=02 Dev#=  2 Spd=1.5 MxCh= 0
D:  Ver= 2.00 Cls=00(>ifc ) Sub=00 Prot=00 MxPS= 8 #Cfgs=  1
P:  Vendor=046d ProdID=c077 Rev=67.00
S:  Manufacturer=Logitech
S:  Product=USB Optical Mouse
C:  #Ifs= 1 Cfg#= 1 Atr=a0 MxPwr=98mA
I:  If#= 0 Alt= 0 #EPs= 1 Cls=03(HID  ) Sub=01 Prot=02 Driver=usbhid

T:  Bus=03 Lev=01 Prnt=01 Port=03 Cnt=03 Dev#=  3 Spd=1.5 MxCh= 0
D:  Ver= 2.00 Cls=00(>ifc ) Sub=00 Prot=00 MxPS= 8 #Cfgs=  1
P:  Vendor=413c ProdID=2107 Rev=05.02
S:  Manufacturer=Dell
S:  Product=Dell USB Entry Keyboard
C:  #Ifs= 1 Cfg#= 1 Atr=a0 MxPwr=70mA
I:  If#= 0 Alt= 0 #EPs= 1 Cls=03(HID  ) Sub=01 Prot=01 Driver=usbhid

T:  Bus=04 Lev=00 Prnt=00 Port=00 Cnt=00 Dev#=  1 Spd=5000 MxCh= 6
D:  Ver= 3.00 Cls=09(hub  ) Sub=00 Prot=03 MxPS= 9 #Cfgs=  1
P:  Vendor=1d6b ProdID=0003 Rev=03.13
S:  Manufacturer=Linux 3.13.0-34-generic xhci_hcd
S:  Product=xHCI Host Controller
S:  SerialNumber=0000:00:14.0
C:  #Ifs= 1 Cfg#= 1 Atr=e0 MxPwr=0mA
I:  If#= 0 Alt= 0 #EPs= 1 Cls=09(hub  ) Sub=00 Prot=00 Driver=hub

T:  Bus=04 Lev=01 Prnt=01 Port=04 Cnt=01 Dev#=  2 Spd=5000 MxCh= 0
D:  Ver= 3.00 Cls=00(>ifc ) Sub=00 Prot=00 MxPS= 9 #Cfgs=  1
P:  Vendor=125f ProdID=312b Rev=10.75
S:  Manufacturer=ADATA
S:  Product=ADATA USB Flash Drive
S:  SerialNumber=2390509550010008
C:  #Ifs= 1 Cfg#= 1 Atr=80 MxPwr=304mA
I:  If#= 0 Alt= 0 #EPs= 2 Cls=08(stor.) Sub=06 Prot=50 Driver=usb-storage
